QuestionNumber | Module | TopicCode | TopicName | AssessmentCriterion | QuestionType | Stem | OptionA | OptionB | OptionC | OptionD | OptionE | CorrectAnswer | Marks | BloomLevel
150 | KM-03 | KT0507 | Feeds & Speeds | Efficiency | TF | Lower cutting speeds generally increase tool life. | True | False |  |  |  | A | 1 | Remember
151 | KM-03 | KT0601 | Workholding & Toolholding | Workholding | MCQ | Which device is commonly used to hold workpieces on a milling machine? | Lathe chuck | Machine vice | Magnetic chuck | Collet | Tailstock | B | 1 | Remember
152 | KM-03 | KT0601 | Workholding & Toolholding | Workholding | TF | A machine vice must be securely clamped to the table before machining. | True | False |  |  |  | A | 1 | Apply
153 | KM-03 | KT0601 | Workholding & Toolholding | Workholding | MCQ | T?slots on a milling table are used for: | Coolant drainage | Mounting clamps and fixtures | Tool storage | Chip removal | Lubrication | B | 1 | Understand
154 | KM-03 | KT0601 | Workholding & Toolholding | Workholding | TF | Clamps and step blocks are used to secure irregular workpieces. | True | False |  |  |  | A | 1 | Apply
155 | KM-03 | KT0601 | Workholding & Toolholding | Workholding | MCQ | A magnetic chuck is commonly used on: | Milling machines | Surface grinders | Lathes | Drilling machines | Band saws | B | 1 | Remember
156 | KM-03 | KT0601 | Workholding & Toolholding | Workholding | TF | Magnetic chucks are suitable for holding ferrous materials only. | True | False |  |  |  | A | 1 | Understand
157 | KM-03 | KT0601 | Workholding & Toolholding | Workholding | MCQ | Soft jaws are used in a chuck to: | Increase speed | Improve accuracy on irregular shapes | Reduce coolant usage | Increase vibration | Hold tools | B | 1 | Apply
158 | KM-03 | KT0601 | Workholding & Toolholding | Workholding | TF | Soft jaws can be machined to match the workpiece profile. | True | False |  |  |  | A | 1 | Apply
159 | KM-03 | KT0602 | Workholding & Toolholding | Toolholding | MCQ | A collet is used to: | Hold large workpieces | Hold small round tools or workpieces | Hold coolant | Hold clamps | Hold parallels | B | 1 | Remember
160 | KM-03 | KT0602 | Workholding & Toolholding | Toolholding | TF | Collets provide better concentricity than standard chucks. | True | False |  |  |  | A | 1 | Understand
161 | KM-03 | KT0602 | Workholding & Toolholding | Toolholding | MCQ | The toolpost on a lathe is used to: | Hold the workpiece | Hold the cutting tool | Hold the chuck | Hold the tailstock | Hold the coolant hose | B | 1 | Remember
162 | KM-03 | KT0602 | Workholding & Toolholding | Toolholding | TF | A quick?change toolpost allows fast tool changes. | True | False |  |  |  | A | 1 | Apply
163 | KM-03 | KT0602 | Workholding & Toolholding | Toolholding | MCQ | End mill holders are used on: | Lathes | Milling machines | Grinders | Drills | Shapers | B | 1 | Remember
164 | KM-03 | KT0602 | Workholding & Toolholding | Toolholding | TF | End mill holders use a set screw to secure the tool. | True | False |  |  |  | A | 1 | Understand
165 | KM-03 | KT0603 | Workholding & Toolholding | Alignment | MCQ | Workpiece alignment in a vice is checked using a: | Hammer | Vernier caliper | Dial indicator | Feeler gauge | Micrometer | C | 1 | Apply
166 | KM-03 | KT0603 | Workholding & Toolholding | Alignment | TF | A dial indicator can be used to ensure a vice is square to the table. | True | False |  |  |  | A | 1 | Apply
167 | KM-03 | KT0603 | Workholding & Toolholding | Alignment | MCQ | Parallels are used to: | Increase cutting speed | Raise the workpiece in the vice | Reduce vibration | Hold tools | Measure depth | B | 1 | Understand
168 | KM-03 | KT0603 | Workholding & Toolholding | Alignment | TF | Parallels ensure the workpiece sits level and clear of the vice jaws. | True | False |  |  |  | A | 1 | Apply
169 | KM-03 | KT0604 | Workholding & Toolholding | Fixtures | MCQ | A jig differs from a fixture because it: | Holds the tool | Guides the tool | Holds the workpiece only | Reduces speed | Controls coolant | B | 1 | Understand
170 | KM-03 | KT0604 | Workholding & Toolholding | Fixtures | TF | Fixtures are used to hold workpieces in a fixed position. | True | False |  |  |  | A | 1 | Remember
171 | KM-03 | KT0604 | Workholding & Toolholding | Fixtures | MCQ | A drill jig is used to: | Hold drills | Guide drills for accurate hole placement | Increase spindle speed | Reduce chip load | Hold coolant | B | 1 | Apply
172 | KM-03 | KT0604 | Workholding & Toolholding | Fixtures | TF | Jigs improve accuracy and repeatability. | True | False |  |  |  | A | 1 | Understand
173 | KM-03 | KT0605 | Workholding & Toolholding | Safety | MCQ | Which action is unsafe when clamping a workpiece? | Using parallels | Tightening clamps securely | Leaving workpiece loose | Using step blocks | Checking alignment | C | 1 | Remember
174 | KM-03 | KT0605 | Workholding & Toolholding | Safety | TF | A loose workpiece can be thrown from the machine. | True | False |  |  |  | A | 1 | Understand
175 | KM-03 | KT0605 | Workholding & Toolholding | Safety | MCQ | Before adjusting a toolholder, the operator must: | Increase speed | Stop the machine | Add coolant | Remove parallels | Raise the table | B | 1 | Apply
176 | KM-03 | KT0605 | Workholding & Toolholding | Safety | TF | Tools must be tightened securely to prevent slipping. | True | False |  |  |  | A | 1 | Apply
177 | KM-03 | KT0605 | Workholding & Toolholding | Safety | MCQ | When using a magnetic chuck, the operator must: | Wear gloves | Ensure the magnet is fully engaged | Use coolant only | Tap the workpiece with a hammer | Increase spindle speed | B | 1 | Apply
178 | KM-03 | KT0605 | Workholding & Toolholding | Safety | TF | Workpieces must be demagnetized after grinding. | True | False |  |  |  | A | 1 | Understand
179 | KM-03 | KT0601 | Workholding & Toolholding | Workholding | MCQ | A four?jaw chuck is ideal for: | Perfectly round workpieces | Irregular or square workpieces | Only soft materials | Only high?speed turning | Grinding operations | B | 1 | Apply
180 | KM-03 | KT0601 | Workholding & Toolholding | Workholding | TF | A four?jaw chuck allows independent adjustment of each jaw. | True | False |  |  |  | A | 1 | Remember
181 | KM-03 | KT0701 | Surface Finish & Tolerances | Surface finish | MCQ | Surface roughness is measured in: | Micrometres (ćm) | Millimetres | Degrees | Newtons | RPM | A | 1 | Remember
182 | KM-03 | KT0701 | Surface Finish & Tolerances | Surface finish | TF | A lower Ra value indicates a smoother surface. | True | False |  |  |  | A | 1 | Understand
183 | KM-03 | KT0701 | Surface Finish & Tolerances | Surface finish | MCQ | A roughing cut typically produces: | Very smooth finish | Medium finish | Rough finish | Mirror finish | No finish | C | 1 | Understand
184 | KM-03 | KT0701 | Surface Finish & Tolerances | Surface finish | TF | Finishing cuts use low feed and shallow depth of cut. | True | False |  |  |  | A | 1 | Apply
185 | KM-03 | KT0702 | Surface Finish & Tolerances | Measurement | MCQ | A surface roughness tester is called a: | Micrometer | Profilometer | Vernier | Comparator | Indicator | B | 1 | Remember
186 | KM-03 | KT0702 | Surface Finish & Tolerances | Measurement | TF | Surface finish can be compared using surface roughness comparison plates. | True | False |  |  |  | A | 1 | Understand
187 | KM-03 | KT0702 | Surface Finish & Tolerances | Measurement | MCQ | A profilometer measures: | Diameter | Surface texture | Hardness | Length | Angle | B | 1 | Understand
188 | KM-03 | KT0702 | Surface Finish & Tolerances | Measurement | TF | Surface finish affects friction and wear. | True | False |  |  |  | A | 1 | Understand
189 | KM-03 | KT0703 | Surface Finish & Tolerances | Tolerances | MCQ | Tolerance refers to: | Exact size | Allowable variation in size | Surface roughness | Material hardness | Tool angle | B | 1 | Remember
190 | KM-03 | KT0703 | Surface Finish & Tolerances | Tolerances | TF | A smaller tolerance range means higher accuracy. | True | False |  |  |  | A | 1 | Understand
191 | KM-03 | KT0703 | Surface Finish & Tolerances | Tolerances | MCQ | A fit where the shaft is always smaller than the hole is a: | Interference fit | Clearance fit | Transition fit | Press fit | Shrink fit | B | 1 | Understand
192 | KM-03 | KT0703 | Surface Finish & Tolerances | Tolerances | TF | Clearance fits allow free movement between parts. | True | False |  |  |  | A | 1 | Remember
193 | KM-03 | KT0703 | Surface Finish & Tolerances | Tolerances | MCQ | A fit where the shaft is always larger than the hole is a: | Clearance fit | Transition fit | Interference fit | Loose fit | Running fit | C | 1 | Understand
194 | KM-03 | KT0703 | Surface Finish & Tolerances | Tolerances | TF | Interference fits require force or heat to assemble. | True | False |  |  |  | A | 1 | Apply
195 | KM-03 | KT0704 | Surface Finish & Tolerances | Limits & allowances | MCQ | Allowance refers to: | Unintentional error | Planned difference between mating parts | Surface roughness | Tool wear | Feed rate | B | 1 | Understand
196 | KM-03 | KT0704 | Surface Finish & Tolerances | Limits & allowances | TF | Allowance is the intentional difference between shaft and hole sizes. | True | False |  |  |  | A | 1 | Remember
197 | KM-03 | KT0704 | Surface Finish & Tolerances | Limits & allowances | MCQ | Upper and lower limits define: | Exact size | Maximum and minimum acceptable size | Surface finish | Hardness | Tool angle | B | 1 | Understand
198 | KM-03 | KT0704 | Surface Finish & Tolerances | Limits & allowances | TF | Limits determine the acceptable size range of a part. | True | False |  |  |  | A | 1 | Understand
199 | KM-03 | KT0705 | Surface Finish & Tolerances | Accuracy | MCQ | Accuracy refers to: | Repeatability | Closeness to the true value | Surface finish | Tool sharpness | Machine speed | B | 1 | Understand
200 | KM-03 | KT0705 | Surface Finish & Tolerances | Accuracy | TF | Precision refers to repeatability of measurements. | True | False |  |  |  | A | 1 | Remember
201 | KM-03 | KT0705 | Surface Finish & Tolerances | Accuracy | MCQ | A part that is precise but not accurate is: | Close to true value | Consistently wrong | Rough | Oversized | Undersized | B | 1 | Understand
202 | KM-03 | KT0705 | Surface Finish & Tolerances | Accuracy | TF | A part can be accurate but not precise. | True | False |  |  |  | A | 1 | Understand
203 | KM-03 | KT0706 | Surface Finish & Tolerances | Symbols | MCQ | Surface finish symbols are shown on: | Electrical diagrams | Machining drawings | Hydraulic circuits | Welding symbols | Safety posters | B | 1 | Remember
204 | KM-03 | KT0706 | Surface Finish & Tolerances | Symbols | TF | A surface finish symbol may specify machining processes. | True | False |  |  |  | A | 1 | Understand
205 | KM-03 | KT0706 | Surface Finish & Tolerances | Symbols | MCQ | A finish mark without numbers indicates: | No machining required | Rough finish | Uncontrolled finish | Smooth finish | Polished surface | C | 1 | Understand
206 | KM-03 | KT0706 | Surface Finish & Tolerances | Symbols | TF | Additional numbers on a finish symbol indicate roughness value. | True | False |  |  |  | A | 1 | Remember
207 | KM-03 | KT0707 | Surface Finish & Tolerances | Applications | MCQ | A bearing surface requires: | Rough finish | Medium finish | Fine finish | No finish | Random finish | C | 1 | Apply
208 | KM-03 | KT0707 | Surface Finish & Tolerances | Applications | TF | Poor surface finish can cause excessive wear. | True | False |  |  |  | A | 1 | Understand
209 | KM-03 | KT0707 | Surface Finish & Tolerances | Applications | MCQ | A sliding fit requires: | Rough surface | Smooth surface | No tolerance | Large clearance | Interference | B | 1 | Apply
210 | KM-03 | KT0707 | Surface Finish & Tolerances | Applications | TF | Surface finish affects lubrication performance. | True | False |  |  |  | A | 1 | Understand
211 | KM-03 | KT0801 | Safety in Machining | PPE | MCQ | Which PPE is essential when operating any machine tool? | Safety glasses | Sandals | Loose gloves | Earphones | No PPE | A | 1 | Remember
212 | KM-03 | KT0801 | Safety in Machining | PPE | TF | Safety glasses must be worn at all times in the workshop. | True | False |  |  |  | A | 1 | Understand
213 | KM-03 | KT0801 | Safety in Machining | PPE | MCQ | Hearing protection is required when: | Machines are off | Noise exceeds safe levels | Only during grinding | Only during milling | Only during drilling | B | 1 | Understand
214 | KM-03 | KT0801 | Safety in Machining | PPE | TF | Ear protection reduces long-term hearing damage. | True | False |  |  |  | A | 1 | Understand
215 | KM-03 | KT0802 | Safety in Machining | Clothing | MCQ | Which clothing item is unsafe in machining? | Overalls | Safety boots | Loose sleeves | Hair net | Apron | C | 1 | Remember
216 | KM-03 | KT0802 | Safety in Machining | Clothing | TF | Long hair must be tied back or covered. | True | False |  |  |  | A | 1 | Apply
217 | KM-03 | KT0802 | Safety in Machining | Clothing | MCQ | Gloves must NOT be worn when: | Handling coolant | Handling sharp swarf | Operating rotating machinery | Cleaning machines | Carrying tools | C | 1 | Understand
218 | KM-03 | KT0802 | Safety in Machining | Clothing | TF | Gloves can get caught in rotating parts. | True | False |  |  |  | A | 1 | Understand
219 | KM-03 | KT0803 | Safety in Machining | Machine hazards | MCQ | The MOST common cause of workshop injuries is: | Sharp tools | Poor lighting | Human error | Machine colour | Clean floors | C | 1 | Understand
220 | KM-03 | KT0803 | Safety in Machining | Machine hazards | TF | Distractions increase the risk of accidents. | True | False |  |  |  | A | 1 | Understand
221 | KM-03 | KT0803 | Safety in Machining | Machine hazards | MCQ | Guards on machines are designed to: | Increase speed | Protect the operator | Reduce accuracy | Store tools | Improve finish | B | 1 | Remember
222 | KM-03 | KT0803 | Safety in Machining | Machine hazards | TF | Machine guards must always be in place during operation. | True | False |  |  |  | A | 1 | Apply
223 | KM-03 | KT0804 | Safety in Machining | Lockout/Tagout | MCQ | Lockout/Tagout is used to: | Increase machine speed | Prevent accidental start-up | Reduce coolant use | Improve finish | Change tools faster | B | 1 | Understand
224 | KM-03 | KT0804 | Safety in Machining | Lockout/Tagout | TF | Machines must be isolated before maintenance. | True | False |  |  |  | A | 1 | Apply
225 | KM-03 | KT0804 | Safety in Machining | Lockout/Tagout | MCQ | A lockout device is placed on: | The toolpost | The power switch | The coolant tank | The chuck | The vice | B | 1 | Remember
226 | KM-03 | KT0804 | Safety in Machining | Lockout/Tagout | TF | Only authorised personnel may remove lockout devices. | True | False |  |  |  | A | 1 | Understand
227 | KM-03 | KT0805 | Safety in Machining | Safe practices | MCQ | Swarf must be removed using: | Hands | Compressed air | A brush or hook | Gloves | A rag | C | 1 | Apply
228 | KM-03 | KT0805 | Safety in Machining | Safe practices | TF | Compressed air must NOT be used to clean clothing. | True | False |  |  |  | A | 1 | Remember
229 | KM-03 | KT0805 | Safety in Machining | Safe practices | MCQ | Before adjusting a machine, the operator must: | Increase speed | Stop the machine | Remove PPE | Add coolant | Change the tool | B | 1 | Apply
230 | KM-03 | KT0805 | Safety in Machining | Safe practices | TF | Machines must come to a complete stop before measurements are taken. | True | False |  |  |  | A | 1 | Apply
231 | KM-03 | KT0806 | Safety in Machining | Environment | MCQ | Slippery floors in a workshop are caused by: | Clean coolant | Oil spills | Good ventilation | PPE | Correct lighting | B | 1 | Understand
232 | KM-03 | KT0806 | Safety in Machining | Environment | TF | Oil spills must be cleaned immediately. | True | False |  |  |  | A | 1 | Apply
233 | KM-03 | KT0806 | Safety in Machining | Environment | MCQ | Good workshop lighting improves: | Tool wear | Accuracy and safety | Machine speed | Coolant flow | Noise levels | B | 1 | Understand
234 | KM-03 | KT0806 | Safety in Machining | Environment | TF | Poor lighting increases the risk of mistakes. | True | False |  |  |  | A | 1 | Understand
235 | KM-03 | KT0807 | Safety in Machining | Fire safety | MCQ | The correct extinguisher for electrical fires is: | Water | Foam | CO? | Sand | Oil | C | 1 | Remember
236 | KM-03 | KT0807 | Safety in Machining | Fire safety | TF | Water must never be used on electrical fires. | True | False |  |  |  | A | 1 | Remember
237 | KM-03 | KT0807 | Safety in Machining | Fire safety | MCQ | Flammable liquids must be stored in: | Open containers | Any cupboard | Approved safety cabinets | Plastic bags | On the floor | C | 1 | Understand
238 | KM-03 | KT0807 | Safety in Machining | Fire safety | TF | Sparks from grinding can ignite flammable materials. | True | False |  |  |  | A | 1 | Apply
239 | KM-03 | KT0808 | Safety in Machining | Behaviour | MCQ | Running or horseplay in the workshop is: | Acceptable | Sometimes allowed | Strictly prohibited | Encouraged | Safe | C | 1 | Remember
240 | KM-03 | KT0808 | Safety in Machining | Behaviour | TF | Only trained operators may use machine tools. | True | False |  |  |  | A | 1 | Understand
1 | KM-04 | KT0101 | Hand Tools | Identification | MCQ | Which tool is used for tightening and loosening nuts and bolts? | File | Hammer | Spanner | Chisel | Hacksaw | C | 1 | Remember
2 | KM-04 | KT0101 | Hand Tools | Identification | TF | A combination spanner has an open end and a ring end. | True | False |  |  |  | A | 1 | Understand
3 | KM-04 | KT0101 | Hand Tools | Identification | MCQ | A ball?peen hammer is mainly used for: | Woodworking | Metalworking | Cutting | Measuring | Welding | B | 1 | Understand
4 | KM-04 | KT0101 | Hand Tools | Identification | TF | A ball?peen hammer is commonly used for riveting. | True | False |  |  |  | A | 1 | Apply
5 | KM-04 | KT0102 | Hand Tools | Files | MCQ | A flat file is used for: | Internal holes | Curved surfaces | General metal filing | Cutting threads | Measuring | C | 1 | Understand
6 | KM-04 | KT0102 | Hand Tools | Files | TF | A half?round file can be used on both flat and curved surfaces. | True | False |  |  |  | A | 1 | Understand
7 | KM-04 | KT0102 | Hand Tools | Files | MCQ | The coarseness of a file is called its: | Pitch | Cut | Grade | Angle | Pattern | B | 1 | Remember
8 | KM-04 | KT0102 | Hand Tools | Files | TF | A bastard cut file is coarser than a second cut file. | True | False |  |  |  | A | 1 | Understand
9 | KM-04 | KT0103 | Hand Tools | Saws | MCQ | A hacksaw is used for cutting: | Wood | Plastic only | Metal | Rubber | Glass | C | 1 | Remember
10 | KM-04 | KT0103 | Hand Tools | Saws | TF | Hacksaw blades with more teeth per inch are used for thin materials. | True | False |  |  |  | A | 1 | Apply
11 | KM-04 | KT0103 | Hand Tools | Saws | MCQ | The correct hacksaw blade tension should be: | Loose | Very tight | Slightly tight | No tension | Random | B | 1 | Understand
12 | KM-04 | KT0103 | Hand Tools | Saws | TF | A loose hacksaw blade can break easily. | True | False |  |  |  | A | 1 | Understand
13 | KM-04 | KT0104 | Hand Tools | Chisels | MCQ | A cold chisel is used for: | Wood | Plastic | Cutting metal | Cutting glass | Measuring | C | 1 | Remember
14 | KM-04 | KT0104 | Hand Tools | Chisels | TF | The cutting edge of a cold chisel must be kept sharp. | True | False |  |  |  | A | 1 | Apply
15 | KM-04 | KT0104 | Hand Tools | Chisels | MCQ | The angle of a cold chisel cutting edge is typically: | 10ř | 30ř | 60ř | 90ř | 120ř | C | 1 | Understand
16 | KM-04 | KT0104 | Hand Tools | Chisels | TF | A mushroomed chisel head is dangerous and must be ground smooth. | True | False |  |  |  | A | 1 | Apply
17 | KM-04 | KT0105 | Hand Tools | Pliers | MCQ | Combination pliers are used for: | Cutting only | Gripping and cutting | Measuring | Filing | Drilling | B | 1 | Understand
18 | KM-04 | KT0105 | Hand Tools | Pliers | TF | Side cutters are designed for cutting wire. | True | False |  |  |  | A | 1 | Remember
19 | KM-04 | KT0105 | Hand Tools | Pliers | MCQ | Long?nose pliers are ideal for: | Heavy cutting | Reaching into tight spaces | Hammering | Filing | Drilling | B | 1 | Understand
20 | KM-04 | KT0105 | Hand Tools | Pliers | TF | Pliers should not be used as a substitute for spanners. | True | False |  |  |  | A | 1 | Apply
21 | KM-04 | KT0106 | Hand Tools | Wrenches | MCQ | An adjustable wrench is also known as a: | Monkey wrench | Pipe wrench | Torque wrench | Allen key | Socket | A | 1 | Remember
22 | KM-04 | KT0106 | Hand Tools | Wrenches | TF | Adjustable wrenches must be tightened properly to avoid slipping. | True | False |  |  |  | A | 1 | Apply
23 | KM-04 | KT0106 | Hand Tools | Wrenches | MCQ | A torque wrench is used to: | Measure length | Apply specific torque | Cut threads | Remove rust | Measure angles | B | 1 | Understand
24 | KM-04 | KT0106 | Hand Tools | Wrenches | TF | Over?tightening bolts can cause thread damage. | True | False |  |  |  | A | 1 | Understand
25 | KM-04 | KT0107 | Hand Tools | Safety | MCQ | Which action is unsafe when using hand tools? | Using correct tool | Keeping tools clean | Using damaged tools | Wearing PPE | Storing tools properly | C | 1 | Remember
26 | KM-04 | KT0107 | Hand Tools | Safety | TF | Damaged tools must be repaired or removed from service. | True | False |  |  |  | A | 1 | Apply
27 | KM-04 | KT0107 | Hand Tools | Safety | MCQ | Tools must be passed to another person: | By throwing | By sliding | Handle first | Sharp end first | Any method | C | 1 | Understand
28 | KM-04 | KT0107 | Hand Tools | Safety | TF | Using the wrong tool for a job increases the risk of injury. | True | False |  |  |  | A | 1 | Understand
29 | KM-04 | KT0108 | Hand Tools | Maintenance | MCQ | Files should be cleaned using a: | Wire brush | File card | Cloth | Screwdriver | Sandpaper | B | 1 | Remember
30 | KM-04 | KT0108 | Hand Tools | Maintenance | TF | Tools must be stored in a dry place to prevent rust. | True | False |  |  |  | A | 1 | Apply
31 | KM-04 | KT0201 | Measuring Tools | Steel rule | MCQ | A steel rule is used to measure: | Internal diameters | External diameters | Straight lengths | Depth only | Angles | C | 1 | Remember
32 | KM-04 | KT0201 | Measuring Tools | Steel rule | TF | A steel rule must be read with the eye directly above the scale to avoid parallax error. | True | False |  |  |  | A | 1 | Understand
33 | KM-04 | KT0201 | Measuring Tools | Steel rule | MCQ | The smallest division on a standard metric steel rule is: | 10 mm | 5 mm | 1 mm | 0.5 mm | 0.1 mm | C | 1 | Remember
34 | KM-04 | KT0201 | Measuring Tools | Steel rule | TF | A steel rule can be used as a straightedge. | True | False |  |  |  | A | 1 | Apply
35 | KM-04 | KT0202 | Measuring Tools | Vernier caliper | MCQ | A vernier caliper can measure: | Only outside diameters | Only inside diameters | Inside, outside and depth | Only depth | Only length | C | 1 | Understand
36 | KM-04 | KT0202 | Measuring Tools | Vernier caliper | TF | Vernier calipers provide more accuracy than steel rules. | True | False |  |  |  | A | 1 | Understand
37 | KM-04 | KT0202 | Measuring Tools | Vernier caliper | MCQ | The accuracy of a standard vernier caliper is typically: | 1 mm | 0.5 mm | 0.1 mm | 0.02 mm | 0.001 mm | D | 1 | Remember
38 | KM-04 | KT0202 | Measuring Tools | Vernier caliper | TF | Vernier calipers must be zeroed before use. | True | False |  |  |  | A | 1 | Apply
39 | KM-04 | KT0203 | Measuring Tools | Micrometer | MCQ | A micrometer screw gauge is used for: | Rough measurements | High?precision measurements | Measuring angles | Measuring weight | Measuring hardness | B | 1 | Understand
40 | KM-04 | KT0203 | Measuring Tools | Micrometer | TF | A micrometer typically has an accuracy of 0.01 mm. | True | False |  |  |  | A | 1 | Remember
41 | KM-04 | KT0203 | Measuring Tools | Micrometer | MCQ | The ratchet stop on a micrometer is used to: | Lock the spindle | Apply consistent measuring force | Increase accuracy automatically | Change units | Adjust the anvil | B | 1 | Understand
42 | KM-04 | KT0203 | Measuring Tools | Micrometer | TF | Excessive force when using a micrometer can damage the tool. | True | False |  |  |  | A | 1 | Apply
43 | KM-04 | KT0204 | Measuring Tools | Feeler gauges | MCQ | Feeler gauges are used to measure: | Length | Diameter | Small gaps or clearances | Angles | Depth | C | 1 | Remember
44 | KM-04 | KT0204 | Measuring Tools | Feeler gauges | TF | Feeler gauges consist of thin metal blades of known thickness. | True | False |  |  |  | A | 1 | Understand
45 | KM-04 | KT0204 | Measuring Tools | Feeler gauges | MCQ | Feeler gauges are commonly used when setting: | Speeds | Feeds | Valve clearances | Cutting angles | Tool height | C | 1 | Apply
46 | KM-04 | KT0204 | Measuring Tools | Feeler gauges | TF | Feeler gauges must be kept clean and free of rust. | True | False |  |  |  | A | 1 | Apply
47 | KM-04 | KT0205 | Measuring Tools | Dial indicators | MCQ | A dial indicator is used to measure: | Weight | Pressure | Small linear deviations | Temperature | Hardness | C | 1 | Understand
48 | KM-04 | KT0205 | Measuring Tools | Dial indicators | TF | Dial indicators are often used for alignment tasks. | True | False |  |  |  | A | 1 | Apply
49 | KM-04 | KT0205 | Measuring Tools | Dial indicators | MCQ | A dial indicator must be mounted on a: | Hammer | Magnetic stand | File | Spanner | Drill chuck | B | 1 | Remember
50 | KM-04 | KT0205 | Measuring Tools | Dial indicators | TF | The plunger of a dial indicator must move smoothly without sticking. | True | False |  |  |  | A | 1 | Understand
51 | KM-04 | KT0206 | Measuring Tools | Gauges | MCQ | A go/no?go gauge is used to check: | Exact size | Acceptable limits | Surface finish | Hardness | Angle | B | 1 | Understand
